{
  "artifact": "scenario_descriptor_v1",
  "schemaVersion": 1,
  "scenarioId": "descriptor-street-row-32x32",
  "layoutKind": "declarative",
  "map": { "width": 32, "height": 32 },
  "terrain": { "mode": "uniform", "uniformHeight": 1 },
  "roadStrokes": [
    {
      "kind": "street",
      "cells": [
        { "x": 8, "y": 16 },
        { "x": 9, "y": 16 },
        { "x": 10, "y": 16 },
        { "x": 11, "y": 16 },
        { "x": 12, "y": 16 },
        { "x": 13, "y": 16 },
        { "x": 14, "y": 16 },
        { "x": 15, "y": 16 },
        { "x": 16, "y": 16 },
        { "x": 17, "y": 16 },
        { "x": 18, "y": 16 },
        { "x": 19, "y": 16 },
        { "x": 20, "y": 16 },
        { "x": 21, "y": 16 },
        { "x": 22, "y": 16 },
        { "x": 23, "y": 16 }
      ]
    }
  ],
  "saveOverlay": {
    "saveName": "descriptor-street-row-32x32",
    "cityName": "Test32"
  }
}
